{
  "$schema": "https://json-schema.org/draft/2020-12/schema",
  "$id": "urn:agent-hub-core:v0.1:work-packet",
  "title": "Agent Hub WorkPacket v0.1",
  "type": "object",
  "additionalProperties": false,
  "required": [
    "version",
    "project",
    "outcome",
    "acceptance_proof",
    "execution_envelope",
    "preferred_level",
    "maximum_level"
  ],
  "properties": {
    "version": {
      "const": 1
    },
    "project": {
      "type": "string",
      "pattern": "^[A-Za-z0-9][A-Za-z0-9._-]{0,127}$"
    },
    "outcome": {
      "type": "object",
      "additionalProperties": false,
      "required": [
        "description"
      ],
      "properties": {
        "description": {
          "type": "string",
          "minLength": 1
        }
      }
    },
    "acceptance_proof": {
      "type": "object",
      "additionalProperties": false,
      "required": [
        "kind",
        "checks"
      ],
      "properties": {
        "kind": {
          "enum": [
            "single",
            "composite"
          ]
        },
        "checks": {
          "type": "array",
          "minItems": 1,
          "uniqueItems": true,
          "items": {
            "type": "string",
            "minLength": 1
          }
        }
      }
    },
    "execution_envelope": {
      "type": "object",
      "additionalProperties": false,
      "required": [
        "repositories",
        "allowed",
        "forbidden"
      ],
      "properties": {
        "repositories": {
          "type": "array",
          "minItems": 1,
          "uniqueItems": true,
          "items": {
            "type": "string",
            "pattern": "^[A-Za-z0-9_.-]+/[A-Za-z0-9_.-]+$"
          }
        },
        "allowed": {
          "type": "array",
          "minItems": 1,
          "uniqueItems": true,
          "items": {
            "type": "string",
            "minLength": 1
          }
        },
        "forbidden": {
          "type": "array",
          "uniqueItems": true,
          "items": {
            "type": "string",
            "minLength": 1
          }
        }
      }
    },
    "preferred_level": {
      "enum": [
        "L0",
        "L1",
        "L2",
        "L3",
        "L4",
        "L5"
      ]
    },
    "maximum_level": {
      "enum": [
        "L0",
        "L1",
        "L2",
        "L3",
        "L4",
        "L5"
      ]
    }
  }
}
